{
  "username": "ZakirBailey",
  "barcode": "12359",
  "active": true,
  "type": "",
  "patronGroup": "503a81cd-6c26-400f-b620-14c08943697c",
  "personal": {
    "firstName": "Bailey",
    "lastName": "Zakir",
    "middleName": "",
    "preferredFirstName": "",
    "email": "new9@new.com",
    "phone": "",
    "mobilePhone": "",
    "addresses": [],
    "preferredContactTypeIds": ["002"]
  },
  "enrollmentDate": "2020-10-07T04:00:00.000+00:00",
  "expirationDate": "2023-02-28T23:59:59.000+00:00"
}
