{
  "username": "ZakirBailey",
  "id": "d3958402-2f80-421b-a527-9933245a3556",
  "barcode": "12359",
  "active": true,
  "type": "",
  "patronGroup": "503a81cd-6c26-400f-b620-14c08943697c",
  "departments": [],
  "proxyFor": [],
  "personal": {
    "lastName": "Zakir",
    "firstName": "Bailey",
    "middleName": "",
    "preferredFirstName": "",
    "email": "new9@new.com",
    "phone": "",
    "mobilePhone": "",
    "addresses": [],
    "preferredContactTypeIds": ["002"],
    "profilePictureLink": "https://folio.org/profiles/picture.jpg"
  },
  "enrollmentDate": "2020-10-07T04:00:00.000Z",
  "expirationDate": "2023-02-28T23:59:59.000Z",
  "createdDate": "2023-02-06T11:16:48.700Z",
  "updatedDate": "2023-02-06T11:16:48.700Z",
  "metadata": {
    "createdDate": "2023-02-06T11:15:35.100Z",
    "updatedDate": "2023-02-06T11:16:48.685Z"
  },
  "customFields": {}
}
