{
  "username": "ZakirBailey",
  "id": "d3958402-2f80-421b-a527-9933245a3556",
  "barcode": "12359",
  "active": true,
  "type": "",
  "patronGroup": "af8ff160-8d4d-4190-bb18-c91dbe8b507b",
  "personal": {
    "lastName": "Zakir",
    "firstName": "Bailey",
    "middleName": "",
    "preferredFirstName": "",
    "email": "new9@new.com",
    "phone": "",
    "mobilePhone": "",
    "addresses": [],
    "preferredContactTypeIds": ["002"]
  },
  "enrollmentDate": "2020-10-07T04:00:00.000+00:00",
  "expirationDate": "2023-02-28T23:59:59.000+00:00"
}
